evidence_id,date_or_range,source_kind,source_or_location,custodian_or_source,artifact_type,provenance,chain_of_custody,operational_use,review_status,privilege_confidentiality,notes
LEG-ADA-001,2026-07-03,repo_artifact,organs/legal/KERNEL.md,Limen repository,organ kernel,"Git-tracked legal organ source document","Repo worktree -> PR review -> counsel-facing packet","Defines legal organ primitives and no-legal-advice boundary",structure_ready,non_privileged_public_repo,"Operating authority for the packet; not case evidence"
LEG-ADA-002,2026-07-03,repo_artifact,organs/legal/CHARTER.md,Limen repository,organ charter,"Git-tracked legal organ source document","Repo worktree -> PR review -> counsel-facing packet","Defines the Cochran-standard workflows and first proof surface",structure_ready,non_privileged_public_repo,"Operating authority for posture/evidence workflows; not case evidence"
LEG-ADA-003,2026-07-03,repo_artifact,organs/legal/FRAMEWORK-FOR-MICAH.md,Limen repository,framework deck,"Git-tracked attorney-facing deck scaffold","Repo worktree -> PR review -> staged for Anthony/Micah review","Packages the legal-operations bench for Micah",structure_ready,non_privileged_public_repo,"Presentation wrapper; not legal advice"
LEG-ADA-004,2026-07-03,repo_artifact,organs/health/KERNEL.md,Limen repository,health/legal bridge,"Git-tracked health organ source document","Repo worktree -> PR review -> legal packet cross-reference","Records that health accommodation outputs feed the legal ADA matter",counsel_review_needed,sensitive_subject_matter,"Bridge record only; no medical or legal advice"
LEG-ADA-005,2026-07-03,repo_artifact,organs/health/CHARTER.md,Limen repository,health/legal workflow,"Git-tracked health organ source document","Repo worktree -> PR review -> legal packet cross-reference","Identifies accommodation documentation as a structured legal-organ input",counsel_review_needed,sensitive_subject_matter,"Bridge record only; no medical or legal advice"
LEG-ADA-006,unprovided,client_counsel_packet_needed,accommodation request and response timeline,Anthony + Micah,source document set,"Not ingested in this public repo","Privileged channel intake required -> assign stable IDs -> attorney verifies","Would populate chronology and document trail after counsel-approved intake",missing_input,privileged_or_sensitive,"Do not paste raw private records into the public repo"
LEG-ADA-007,unprovided,client_counsel_packet_needed,employment records and communications,Anthony + Micah,source document set,"Not ingested in this public repo","Privileged channel intake required -> assign stable IDs -> attorney verifies","Would support factual chronology after counsel-approved intake",missing_input,privileged_or_sensitive,"Do not paste raw private records into the public repo"
LEG-ADA-008,unprovided,counsel_confirmation_needed,forum jurisdiction venue and deadlines,Micah,attorney confirmation,"Not supplied in this public repo","Counsel confirmation -> deadlines.md update -> weekly review","Would convert the deadline posture into an approved calendar",missing_input,attorney_work_product_needed,"No deadline is treated as confirmed until counsel supplies it"
